Reward Name,Requirements,Prerequisites,Your Reward,Reward for Others
Ritual of Divination,Explore OoC Social Media,N/A,500 XP,Our Social Media: Your fellowship!
Ritual of Scrying,Declare your gaming location on our Google Map,N/A,500 XP,Our Map: Another marked venue!
Welcome to the Dark Side,Recruit an Adventurer's League player,N/A,1000 XP per tier of converted character,Recruit: May convert character to beginning of next level
Can We Keep Them?,Recruit any new player,N/A,Variable (see description),Recruit: Potion of Healing / DM/Other Players: Bonus XP
Part of the Team,Participate as a Player in an Epic Mission,,Storyline Contact,NA